{
  "protocol": "agent-identity-v1",
  "audience": "vaporcloud",
  "provider_name": "VaporCloud",
  "issuer_allowlist": [
    "https://id.agentregistrar.dev"
  ],
  "required_scopes": [
    "tos:accept"
  ],
  "terms": {
    "version": "2026.1",
    "url": "https://vaporcloud.example/terms",
    "sha256": "sha256:956d4a2d460a34d94aeb8b57fff29c0c7b846f5c8d1cd080ce264bf3314642f0",
    "text": "VaporCloud Terms of Service, version 2026.1. By accepting these terms, your verified human principal is bound to them and to VaporCloud's acceptable-use and appliance-safety rules."
  },
  "endpoints": {
    "agent_signup": "https://vaporcloud.example/api/signup/agent"
  }
}
